<?xml version="1.0" encoding="UTF-8" ?>
<xs:schema xmlns:xs="http://www.w3.org/2001/XMLSchema">
    <xs:element name="FoodChain">
        <xs:complexType>
            <xs:sequence>
                <xs:element ref="Company" maxOccurs="unbounded"></xs:element>
            </xs:sequence>
        </xs:complexType>
    </xs:element>

    <xs:element name="Company">
        <xs:complexType>
            <xs:sequence>
                <xs:element name="Name" type="xs:string" />
                <xs:element name="Headquarters" type="xs:string" />
                <xs:element name="EstablishedYear" type="xs:positiveInteger" />
                <xs:element ref="Branches" />
            </xs:sequence>
            <xs:attribute name="id" type="xs:string" />
        </xs:complexType>
    </xs:element>

    <xs:element name="Branches">
        <xs:complexType>
            <xs:sequence>
                <xs:element ref="Branch" maxOccurs="unbounded" />
            </xs:sequence>
        </xs:complexType>
    </xs:element>

    <xs:element name="Branch">
        <xs:complexType>
            <xs:sequence>
                <xs:element name="Location" type="xs:string" />
                <xs:element name="Employees" type="xs:positiveInteger" />
                <xs:element ref="Manager" />
                <xs:element ref="Menu" />
            </xs:sequence>
            <xs:attribute name="id" type="xs:string" />
        </xs:complexType>
    </xs:element>

    <xs:element name="Manager">
        <xs:complexType>
            <xs:sequence>
                <xs:element name="Name" type="xs:string" />
                <xs:element ref="Contact" />
            </xs:sequence>
        </xs:complexType>
    </xs:element>

    <xs:element name="Contact">
        <xs:complexType>
            <xs:sequence>
                <xs:element name="Email" type="xs:string" />
                <xs:element name="Phone" type="xs:string" />
            </xs:sequence>
        </xs:complexType>
    </xs:element>

    <xs:element name="Menu">
        <xs:complexType>
            <xs:sequence>
                <xs:element ref="Item" maxOccurs="unbounded" />
            </xs:sequence>
        </xs:complexType>
    </xs:element>

    <xs:element name="Item">
        <xs:complexType>
            <xs:sequence>
                <xs:element name="Name" type="xs:string" />
                <xs:element name="Category" type="xs:string" />
                <xs:element ref="Price" />
            </xs:sequence>
            <xs:attribute name="id" type="xs:string" />
        </xs:complexType>
    </xs:element>

    <xs:element name="Price">
        <xs:complexType>
            <xs:simpleContent>
                <xs:extension base="xs:float">
                    <xs:attribute name="currency" type="xs:string" />
                </xs:extension>
            </xs:simpleContent>
        </xs:complexType>
    </xs:element>
</xs:schema>